单位名称,许可备案号,许可有效期,注册地址,场所地址,法人姓名
北京华远西单购物中心有限公司西单文化广场分公司,西文游第02号,,西单北大街180号（西单文化广场地下一层）,,陈奕军/于锦义
北京华威佳佳游戏厅,西文游第03号,,西单北大街130号(八层),,黄长印/李大庆
中印集团文化有限责任公司北京动感时光电子游艺厅,西文游第08号,,红莲南路57号,,
北京金宝乐动漫科技有限公司,西文游第10号,,广安门外车站西街9号聚京缘酒店一层,,
北京金巧手游艺厅,西文游第12号,,马连道南街2号院8号楼二层,,
北京福丽特联益通电子游艺厅有限公司,西文游第16号,,黄寺大街23号A16,,王海全
北京同一首歌餐饮娱乐有限公司红莲分公司,西文游第22号,,红莲南路28号6-1幢1层2、3层部分,,
北京乐游文化发展有限公司,西文游第24号,,西直门外大街1号西环广场嘉茂购物中心5层,,
北京乐唯乐斯电子娱乐有限公司,延文游2012002,,延庆县延庆镇高塔街58号绿韵购物广场J店,,孟 辉/孟辉
北京动感新意游艺有限公司,延文游2012003,,延庆县延庆镇妫水北街39号1幢H座一层,,辛时建/辛时建
北京聚玩堂电子娱乐有限公司,延文游2012005,,延庆县延庆镇东外大街26号,,张宇/张宇
北京美奇乐娱乐有限公司,延文游2012007,,延庆县延庆镇妫水北街39号1幢H座,,田磊/田磊
北京新都会电子娱乐有限公司,延文游2012008,,延庆县康庄镇兴隆南街1号一层,,田万辉/刘伟
北京快乐谷电子娱乐有限公司,延文游2012009,,北京市延庆县东顺城街13号,,梁伟业/梁伟业
北京梦幻乐园电子游艺有限公司,延文游2015001,,延庆县延庆镇东外大街22号,,赵会芳/赵会芳
北京达兴娱乐中心,重审京兴文娱2011003号,,大兴区黄村镇兴华大街二段72号,大兴区黄村镇兴华大街二段72号,康海涛
